{
  "merchant_supplied_id": "D-12345",
  "name": "Acme Pickup Store",
  "description": "Leave at the front desk.",
  "image_url": "https://example.com/path/abc123",
  "brand": "example",
  "upc": "example",
  "category": "example",
  "subcategory": "example",
  "weight": 12.5,
  "weight_unit": "oz",
  "is_alcohol": true
}
